Company Name,Website URL,Has Facebook,Facebook URL,Facebook Page Name,Verified Page,Followers,Phone (Facebook),Email (Facebook),Address (Facebook),Website (Facebook),Emails (Website),Phones (Website),Found Via,Description Snippet,Scraped At
Agents et Promoteurs immobiliers,https://www.minhdu.gov.cm/agents-et-promoteurs-immobiliers/,Yes,https://www.facebook.com/cameroun.minhdu,Discussions,Yes,41000,61783010,,,http://www.minhdu.gov.cm/?fbclid=IwZXh0bgNhZW0CMTAAYnJpZBExeGVPY21vZkFMR1cwSFhsV3NydGMGYXBwX2lkEDIyMjAzOTE3ODgyMDA4OTIAAR4-d6mu6SG1udt3zOx_DaDevLeLDbPDy0Ib3ZHMkteknm6sB4cjChpjQdZINg_aem_YsOGRwgKSy6endN2pXRqbw,info@minhdu.gov.cm,"20100101; 20220616; 20240202; 22222210; 20251028; 20240913; 20230829",google_serpapi,QUELLES SONT LES CONDITIONS D'ELIGIBILITE A LA PROFESSION DE PROMOTEUR IMMOBILIER ? · Être de nationalité camerounaise ou ressortissant d'un État étranger ayant ...,2026-03-16T12:31:06.752Z
"LM Platinum Estates, Agence Immobilière",https://lmplatinumestates.cm/?srsltid=AfmBOornrF4uo0_b_UQvVgg9u6v8MuwHrpckOe4ik7tzVUzgny55FvDK,No,,,,,,,,,,,google_serpapi,L'agence immobilière LM Platinum Estates est une entreprise camerounaise immobilière qui a un engagement sérieux avec la satisfaction du client au premier plan.,2026-03-16T12:31:32.470Z
AGIICAM - Agence Immobilière à Yaoundé et Douala ...,https://www.agiicam.com/?srsltid=AfmBOopvo6v-TgCmYpNdktwUAW1uzQR5GAhhpkPhJFQ7sAnWs3TLG2cI,No,,,,,,,,,,,google_serpapi,"AGIICAM, votre agence immobilière de confiance au Cameroun. Achat, vente, location et gestion de biens immobiliers à Yaoundé, Douala, et plus encore.",2026-03-16T12:31:39.802Z
Bâtiment (entreprises) au Cameroun,https://africannuaire.com/resultat/?infos=B%C3%A2timent+%28entreprises%29&ville=Cameroun,No,,,,,,,,,,"36025133; 34836511; 33422171; 33410744; 33373601; 33421169; 33430679; 33431958; 22218181; 33375526; 33425943; 22018611; 33759051; 33407508; 33426925; 33432911; 33471785; 33472350; 33439178; 33436743; 33439104; 33438682; 20250206; 20260120; 62183081",google_serpapi,"Bâtiment (entreprises) au Cameroun ; AFRIQUE CONSTRUCTION · 233 42 21 71 ; ALL BUILDING COMPANY · 233 41 07 44 ; ASQUINI ENCORAD · 233 37 36 01 ; BATI SERVICE · 233 42 ...",2026-03-16T12:31:45.436Z
"TNG BTP SARL – Batiments et Travaux publique,Génie Civil",https://tngbtp.com/,No,,,,,,,,,,,google_serpapi,"Entreprise Camerounaise qui offre aux clients une gamme complète de services et de solutions liés à la construction, à la rénovation et à la démolition des ...",2026-03-16T12:31:50.554Z
BIGC-BTP – Bureau d'Ingenieurs de Genie Civil,https://bigcbtp.com/,Yes,https://www.facebook.com/share/18bwZTfB9S,Discussions,Yes,3000,61783030,bigcbtpsarl@yahoo.com,,,bigcbtpsarl@yahoo.com,"+23767807094; +23769679475; 67807094; 69679475; 20250221; 67108864; 20251001",google_serpapi,BIGC BTP est une entreprise de génie civil spécialisée dans le bâtiment et travaux publics. Nous maîtrisons une large palette de savoir-faire en construction ...,2026-03-16T12:31:58.906Z
Entreprise BTP Construction Rénovation Génie Civil ...,https://www.renovbuilding.cm/services,Yes,https://www.facebook.com/renovbuilding,Discussions,Yes,867,61783037,contact@renovbuilding.cm,🏗️Renov Building – Entreprise camerounaise de BTP basée à Yaoundé.,https://api.whatsapp.com/send?phone=+237670726237&token=eyJhbGciOiJFUzI1NiIsInR5cCI6IkpXVCIsImtpZCI6IjEyNSJ9.eyJleHAiOjE3NzM3NTA3NTAsInBob25lIjoiKzIzNzY3MDcyNjIzNyIsImNvbnRleHQiOiJBZmRNdGUtdkRPcElNUXhMVVdKWHRkNVZMbHZUOTkwMEVhajR5dWZYNlFpMzRaZlVTRTdBZjNpUFE0bE9FX1huRFdHQWR3LWVDRl9rbG5kRjlha1Q3SmY2QVRHQ3JfX0JOZHhFX1QydnVmdVhLLTNLdS1qYjY0WjVZWDdoTE5ScXUySzRqVDVzUFVzX1lVUzdBWDZGWDVhcXBBIiwic291cmNlIjoiRkJfUGFnZSIsImFwcCI6ImZhY2Vib29rIiwiZW50cnlfcG9pbnQiOiJwYWdlX2N0YSJ9.8PqBmJgH1n6PL3LLgoUy7_L61302Y3GdDt6ANjkWbTjQ7L0MkD-alG9DQkGT2lrlWdSHQQ5xtUF6gTz3dxxGqQ&fbclid=IwZXh0bgNhZW0CMTAAYnJpZBExeGVPY21vZkFMR1cwSFhsV3NydGMGYXBwX2lkEDIyMjAzOTE3ODgyMDA4OTIAAR4SvkfXNXFSmbGk4OL5NdDDA-o5YZ9snBym0hh-Xm8oiegIGyLG61ihuDNPHQ_aem_UTGBsUbjmwdb9LNB5U0zjA,contact@renovbuilding.cm,+23767072620,google_serpapi,"Renov Building, entreprise leader du secteur BTP au Cameroun spécialisée en construction durable, rénovation complète, travaux de génie civil, ...",2026-03-16T12:32:18.465Z
CABTÉ - Compagnie de Construction,https://www.cabte.cm/,No,,,,,,,,,"contact@cabte.cm; cabtesarl@ymail.com",,google_serpapi,Nous exercons dans le secteur de la construction depuis plus de 15 ans avec de multiples projets de construction livrés dans les batiments et travaux publics.,2026-03-16T12:32:35.671Z
Annuaire BET & ETP 2011,https://aedic.eu/wp-content/uploads/2018/07/Annuaire-BET-et-ETP-2011-lista-delel-societ%C3%A0-operative-per-costruzioni-in-camerun.pdf,No,,,,,,,,,,"20110720; 31360000; 26250000; 29780000; 61020000; 68980000; 67000000; 61430000; 32010000; 33060000; 33670000; 27360000; 34390000; 27570000; 35000000; 35610000; 36220000; 33170000; 36830000; 33380000; 37440000; 21140000; 38050000; 22580000; 38660000; 24020000; 39270000; 25460000; 39880000; 26900000; 26370000; 28340000; 26580000; 63580000; 63490000; 69490000; 61110000; 61450000; 64640000; 64880000; 68160000; 68680000",google_serpapi,ENTREPRISE DE CONSTRUCTION. POLYVALENTE ET DE. CONCEPTION. ETP. 3238 Douala. 33 04 45 93. 58 ETPC. ENTREPRISE ETPC. ETP. 59 E.G.T.P.S.. ENTREPRISE GENE DES TRAV ...,2026-03-16T12:32:46.994Z
Top 16 Property Development Companies in Cameroon,https://www.businesslist.co.cm/category/property-development,No,,,,,,,,,,"37652383; +23767046622; +23723332204; 67457307; 0023724301132; 62027671; 60162013; 67661114; 22167131; +23767130863; 69063612; +23768342172; 67082653; +23765698059; 37703850; +23722043338; +23722096988",google_serpapi,BRILLIAN AND CO. GROUP LTD · Hilotech Construction Ltd · Maibeta Inc. · Star Architecture and Construction Group · Rainbow Property Management Company.,2026-03-16T12:32:57.219Z
CFB Holding Ltd: Approved Real Estate Developer in ...,https://cfbholding.com/cfb-holding-ltd-now-an-approved-real-estate-developer-in-cameroon/,Yes,https://www.facebook.com/people/CFB-Holding-Ltd/61555691876999,Discussions,Yes,14,61783057,,,,john@doe.com,"20250314; 20251209; 36267898; 61555691; 23782715",google_serpapi,"CFB Holding Ltd unveils its status as a Real Estate Developer in Cameroon, focusing on sustainable living and quality housing.",2026-03-16T12:33:03.900Z
How ACCREG Transforms Ideas into Reality,https://accregltd.org/best-contractors-in-douala/,No,,,,,,,,,,"20260201; 62938724",google_serpapi,"ACCREG, best contractors in douala and real estate developers in Cameroon, delivers innovative solutions, turning ideas into reality.",2026-03-16T12:33:21.701Z
Top Real Estate Developers In Cameroon,https://siges-copy.univ-dschang.org/blog/top-real-estate-developers-in-cameroon-1767648757,No,,,,,,,,,,,google_serpapi,Why Choose a Reputable Real Estate Developer? · Key Players in Cameroon's Real Estate Scene · 1. Groupe ARNO · 2. Dynasty Group · 3. Sogea Satom · 4.,2026-03-16T12:33:32.269Z
property developers Cameroon,https://www.groupvictorw.com/tag/property-developers-cameroon/,No,,,,,,,,,contact@groupvictorw.com,31536000,google_serpapi,Group Victor is a leading family-owned company dedicated to improving lives and driving transformation in Cameroon and beyond. Quick Links.,2026-03-16T12:33:48.603Z
Cameroon Investment Properties – Buy-to-Let & Commercial,https://veles-club.com/projects/cameroon,Yes,https://www.facebook.com/VelesClub.int,Discussions,Yes,76000,61783079,,,https://www.instagram.com/velesclub_int?fbclid=IwZXh0bgNhZW0CMTAAYnJpZBExeGVPY21vZkFMR1cwSFhsV3NydGMGYXBwX2lkEDIyMjAzOTE3ODgyMDA4OTIAAR6Ks3DG8Flv_FU8tAbYswAL9bj06i3JkQf2mYg4x4ubAzQaxOO1xAqNe1LfGw_aem_Qw0GISbUg9Yp_9wrXV5K0g,info@veles-club.com,"20250808; 20250809",google_serpapi,"Find top investment properties in Cameroon, from studio-apartments to luxurious villas. VelesClub Int. supports foreign and local investors with market ...",2026-03-16T12:33:55.102Z
List of Real estate developer in Cameroon,https://www.fastbase.com/countryindex/Cameroon/R/Real-estate-developer,No,,,,,,,,,,"+23765321721; +23767781899; +23767280012; +23769988831; 69836248; +23769836248; +23765841664; +23767769162; +23769947980; +23767563801; +23769422313; +23765871197; +23722222754; +23768068798; +23769801010; +23769843962",google_serpapi,Compare the best companies in Real estate developer category. Buy complete list of 26 Real estate developer in Cameroon. · Maykari Residence · Sci Methode Ii.,2026-03-16T12:34:12.836Z
Les agences immobilières à Douala et au Cameroun,https://www.goafricaonline.com/cm/annuaire/agences-immobilieres,No,,,,,,,,,,"33425004; 22011527; 69059752; 65743929",google_serpapi,"Les meilleures agences immobilières de Douala et du Cameroun ; 237immobilier · Nv Rte Mimboman Centre Region Yaoundé - Cameroun · 691 97 00 90 ; ACMA IMMOBILIER.",2026-03-16T12:34:18.653Z
"Immo Elite - L'immobilier d'exception, accessible à tous",https://www.immoelites.com/,No,,,,,,,,,contact@immoelites.com,,google_serpapi,"Immo Elite est une agence immobilière établie à Yaoundé, spécialisée dans la location, la vente et la gestion de propriétés de prestige. Notre mission est de ...",2026-03-16T12:34:25.013Z
AfriqPnB: Location d'Appartements,https://afriqpnb.com/,No,,,,,,,,,,"60791786; 29915624; 27789964",google_serpapi,"Sentez-vous chez vous partout. Hébergements, Voitures, Restaurants & Expériences. Logements vérifiés avec vidéos • Paiements locaux • Support 24/7 ...",2026-03-16T12:34:29.934Z
Agences immobilières | Walazouo,https://cm.walazouo.com/fr/agencies?ShortBy=asc&View=list,Yes,https://www.facebook.com/A2MImmobilierCameroun,Discussions,Yes,11000,61783095,,,https://api.whatsapp.com/send?phone=+237687436869&token=eyJhbGciOiJFUzI1NiIsInR5cCI6IkpXVCIsImtpZCI6IjEyNSJ9.eyJleHAiOjE3NzM3NTA4ODQsInBob25lIjoiKzIzNzY4NzQzNjg2OSIsImNvbnRleHQiOiJBZmZ6MjhMcUxtQnNGd2JmUmgxbllKZHpaM2pwUTlXYW9oTmc2Sno1ZHFYbk83ZnV0YmNxTnhuNURIQVZuNVFLUGZZam5VVXUwNWVIbmlPUUxpcXJBSFBndy1sLVNacURjdmlhLXE3SXFGYWRmVDNPdGQyNUhYMEJfeVZHdm5OS1JoRU43Q3NxLXEtVWQtRnh1MFhrMFFHVHN3Iiwic291cmNlIjoiRkJfUGFnZSIsImFwcCI6ImZhY2Vib29rIiwiZW50cnlfcG9pbnQiOiJwYWdlX2N0YSJ9.HJkkb83Iz7qH759LC3mY2cMYeyWmYD1zDIf30iCtgcg6cZxVZ9l8zZ6nkZycYN0d8PYg3wjZUhkVobRDgoz3uA&fbclid=IwZXh0bgNhZW0CMTAAYnJpZBExeGVPY21vZkFMR1cwSFhsV3NydGMGYXBwX2lkEDIyMjAzOTE3ODgyMDA4OTIAAR7gB-WVcVrvDqrdmZ6gCzMixhn1aQmShGSQX4v4MbvK4zcZ2fXtj1RUAjwVPQ_aem_hz9RUQ0iccZpaUVHSovKjw,"immobiliera2m@gmail.com; contact@abbasimmob.cm; logementsducam@yahoo.fr; contact@agiicam.com; ntcodecsarl@gmail.com; droneimmobilier03@gmail.com; info@walazouo.com","36972200; 35472200; 68213800; 67868700; 28841200; 36716600; 35331800; 62984110; 63155890; 65878210; 32100950; 63815800; 27134700; 62350500; 25440440; 39656000; 63051300; 22448510; 67597720; 30170000; 33236200; 32260160; 39338900; 31199450; 33814880; 66830200; 67679580; 36730840; 26322430; 22465600; 63332680; 20283200; 26295800; 69958230; 38085000; 69401040; 26054200; 68136400; 65084010; 24779700; 39428800; 68704590; 33021800; 38596300; 64937500; 23974600; 38892800; 31628200; 69959900; 34943000; 69331390; 34859500; 22764900; 34591700; 22570600; 24312300; 22931600; 69679630; 60605400; 36340000; 28004500; 69749280; 38639900; 23453200; 27282800; 69993060; 27199300; 36388600; 69470680; 35902000; 32155400; 32222300; 38438900; 35330600; 27770800; 39849900; 65989400; 69012200; 20543200; 26936800; 29068000; 33292100; 32880200; 25961600; 69039900; 25338400; 24790300; 21534800; 61945100; 30955400; 35194900; 35508100; 26751400; 66786400; 66667000; 37919300; 27401000; 34151500; 22340000; 21863500; 28137400; 27913000; 64215000; 34751700; 25734800; 21964000; 62437500; 34857300; 30051400; 39014600; 61427600; 63898900; 68009000; 23040000; 31646200; 33915700; 37053700; 29464100; 64780000; 62818750; 31126100; 66744900; 23248200; 66712100; 69409300; 69190000; 26866200; 61685300; 20229200; 29018900; 68520000; 26310800; 32139500; 24013500; 27318800; 64712900; 24418300; 39191900",google_serpapi,"Toutes les agences immobilières ; A2M Immobilier. odza Koweit, Yaoundé, Cameroon · +237 6 76 87 82 00 ; Abbas Immobilier. Nouvelle route Bastos, Yaoundé, Cameroon.",2026-03-16T12:34:34.700Z
Zenith Immobilier - Excellence et Innovation dans l'Immobilier ...,https://zenithimo.com/,No,,,,,,,,,,,google_serpapi,"Leader de l'immobilier au Cameroun depuis 2011, spécialisé dans la vente, location et gestion de biens immobiliers. Contact. +237 685 12 65 35; info@zenithimo.",2026-03-16T12:34:49.486Z
Legacy Housing And Real Estate Ltd Cameroon | Bamenda,https://www.facebook.com/legacylandsandhousesforsale/,No,,,,,,,,,,,google_serpapi,"Properties (Lands & Houses) for Sale and on Rent All Over Cameroon - Bamenda, Buea, Limbe, Douala, Yaoundé",2026-03-16T12:34:56.045Z
Guest Houses,https://geniecapital.co/p/guest-houses,Yes,https://www.facebook.com/GenieCapitalLtd,Discussions,No,,61783108,,,,info@geniecapital.com,,google_serpapi,"Genie Capital Ltd is an Investment and Property Management company with Head Office in Buea - SW Cameroon and operations in Limbe - SW Cameroon, Douala - LT ...",2026-03-16T12:35:04.352Z
House Rental & Property Sales in Cameroon,https://amigoconsultingcm.com/house,Yes,https://www.facebook.com/amigo%20consulting,Discussions,No,,61783115,,,,"amigoconsultingcm@gmail.com; teams-cameroon@amigoconsultingcm.com",60518883,google_serpapi,"Find Your Dream Home in Cameroon. Discover the perfect property for rent or sale. From luxury homes to affordable apartments, studios, and commercial spaces ...",2026-03-16T12:35:18.979Z
STARLINE CONSTRUCTION CAMEROON – Building Dreams,https://www.starlinecam.com/,No,,,,,,,,,info@starlinecam.com,"37514805; 20162017; 20342038; 20702071; 21002112; 21142115; 21172121; 22132214; 24742475; 21942199; 22182219; 29212922; 61006363; 35371172; 32666666; 23404255; 36170212; 33333333; 66666667; 66666666; 32323260; 32323210; 20210125; 20210801; 20191219; +23767568904",google_serpapi,"Company Info. Suite 03, Immeube Ex-Sia B.P. 13255 Bonanjo Douala – Cameroon. info@starlinecam.com. Tel: +237 675689040. BUSINESS HOURS. MON 8:00 AM – 18:00 PM",2026-03-16T12:35:33.868Z
Residential Building Contractors in Cameroon,https://truvok.com/residential-building-contractors-in-cameroon-your-ultimate-guide/,Yes,https://www.facebook.com/truvok,Discussions,Yes,37000,61783125,,"The Leading Construction firm in Cameroon, in partnership with the best Architects to give you a seamless Construction experience.",https://api.whatsapp.com/send?phone=+237621777356&token=eyJhbGciOiJFUzI1NiIsInR5cCI6IkpXVCIsImtpZCI6IjEyNSJ9.eyJleHAiOjE3NzM3NTA5NTUsInBob25lIjoiKzIzNzYyMTc3NzM1NiIsImNvbnRleHQiOiJBZmVrZGx1cDRkcy1sbkRLUnhJdUJ0dVU4MWRVaUwwWmpjRFBLWnJjS01jb0Nzd2d2UDNyLWF1c3dsYmUwTFVoNlgtempjZmR6VVdLd2doZnF5ZEdHSm5nbFVqZ0JNTkUtYnpBM0JsOC1KQ3dvM3Vwd2pTMmpidHRtZTM3T3JqNXFhLTNUUS1CNVBHcC1aQmdiNzZ5YVN6SG1BIiwic291cmNlIjoiRkJfUGFnZSIsImFwcCI6ImZhY2Vib29rIiwiZW50cnlfcG9pbnQiOiJwYWdlX2N0YSJ9.vK1J2_H_9GtCSOd_zNVe-tR0X6WPYbt23MCh3d2R8SSHhXeht5eX_xuiWkxGloonqCynY-qOpD0jq92hCG4udQ&fbclid=IwZXh0bgNhZW0CMTAAYnJpZBExeGVPY21vZkFMR1cwSFhsV3NydGMGYXBwX2lkEDIyMjAzOTE3ODgyMDA4OTIAAR57GDj6syipB_dyP9lfF0zvoZCcVK-bLwEAFNjlXT8l7YWn2QzPSXTrhVVwkQ_aem_-BYgYJYLXkcSO6g8cyVCKA,contact@truvok.com,"20240823; 61804697; +23767474444; 30203630",google_serpapi,"In this guide, we'll explore everything you need to know about residential building contractors in Cameroon, including what to look for, the ...",2026-03-16T12:35:41.085Z
Building and Roofing Industry of Cameroon: Accueil,https://briccameroun.com/,Yes,https://www.facebook.com/briccm,Discussions,Yes,985,61783134,,BRIC Cameroun S.A.,https://api.whatsapp.com/send?phone=+237677788558&token=eyJhbGciOiJFUzI1NiIsInR5cCI6IkpXVCIsImtpZCI6IjEyNSJ9.eyJleHAiOjE3NzM3NTA5NzQsInBob25lIjoiKzIzNzY3Nzc4ODU1OCIsImNvbnRleHQiOiJBZmRkVTVhNjZ2MGVyaGtvWkxydm1KMlE0dG90ZnRBa1FXSG9BR3lyU1JfQnM4ajVyNVpBNmU3WGppUXhEZE5sUnUzZlFfU0RVanZMUzBOOWx3QkJ2eEREOTNhS1dQY0s5RVdYWWZoSVVNN3pCMmRieUY5b25xR0Y0RUw3M0l1QkwyRUltTzVLTlc4TFFaamtCWUdVbG1Ka01RIiwic291cmNlIjoiRkJfUGFnZSIsImFwcCI6ImZhY2Vib29rIiwiZW50cnlfcG9pbnQiOiJwYWdlX2N0YSJ9.9jBcD6I6KvxDsyc-ZzfAodm_yY4qGsBETkjF60WLEJNJ3ItzCJWfVyY0atnhoH1OHXWn-FVtME2RZNYs6Ytv6A&fbclid=IwZXh0bgNhZW0CMTAAYnJpZBExeGVPY21vZkFMR1cwSFhsV3NydGMGYXBwX2lkEDIyMjAzOTE3ODgyMDA4OTIAAR4584S9NU1a7oHx71162Iq2GmUFookEMNh4Sz9GF6tSarIfxJ5IftVlEI7nyg_aem_s8mx--rTycDPUORRdFun0Q,,"20170430; 20221205; 20250206; 30539140; 31309545; 62313825; 63710212",google_serpapi,"BRIC SA (Building and Roofing Industry of Cameroon) est une Société de droit Camerounais, exerçant dans la fabrication des matériaux de construction, le génie ...",2026-03-16T12:36:00.753Z
Top 10 Construction Companies in Cameroon (2025),https://accregltd.org/top-10-construction-companies-in-cameroon-2025/,No,,,,,,,,,,"20250503; 20250502; 62938724",google_serpapi,1. A & C Contractors and Real Estate Group: Shaping Cameroon's Future · 2. Societe Buns: A Force in Infrastructure Development · 3. Force ...,2026-03-16T12:36:19.102Z
Top 33 Construction Companies in Cameroon - Mar 2026,https://www.businesslist.co.cm/category/Construction,No,,,,,,,,,,"+23767046622; 22220135; 0023724301132; 23333211; 67489080; 67054819; +23722222055; 69864457; 22167131; 33400718; 34668520; +23769412566; 33374758; 33436250; 33373530; 33391192; 33432881; 33437293; 68017917",google_serpapi,We found 33 listings in Cameroon · Hilotech Construction Ltd · NDUMU NJI Vincent · Rainbow Property Management Company · ALEXANDER DRILLING COMPANY LTD.,2026-03-16T12:36:26.017Z
M&D Construction: Construction Company in Cameroon ...,https://mdconstructioncameroon.com/,No,,,,,,,,,contact@mdconstructioncameroon.com,"20251217; 20260116; 68539329; 33333333; 66666666; 28571428; 31529821; +23765474309",google_serpapi,"Licensed construction company delivering public works, commercial buildings, and residential projects from Douala to Yaoundé and beyond. Over 10 years of ...",2026-03-16T12:36:31.087Z
Toutes les villes - adpmrealestate,https://adpmrealestate.com/fr/,Yes,https://www.facebook.com/ADPMCameroun,Discussions,Yes,26000,61783149,info@adpm-investiraucameroun.com,"Carrefour rail kilomètre 5 , Douala, Cameroon",http://www.adpm-investiraucameroun.com/?fbclid=IwZXh0bgNhZW0CMTAAYnJpZBExeGVPY21vZkFMR1cwSFhsV3NydGMGYXBwX2lkEDIyMjAzOTE3ODgyMDA4OTIAAR7SFgbFakLOsb_jzR9NY8ENmG1UJs_HfHBkKfx-7jA3jTF5q6Fj0Po7UoBX_w_aem_sFfH0GCeWdy27B4TLwVtaw,Cameroun@adpmrealestate.com,"0023769352952; 20251123; 65356495",google_serpapi,"Douala. More Details · 25 Properties. Yaoundé. More Details · 1 Property. Kribi. More Details. ""ADPM Real Estate m'a permis d'acheter sereinement depuis la ...",2026-03-16T12:36:40.852Z
"La Liste des Agents immobiliers dans le Yaoundé, Cameroun",https://fr.businesslist.co.cm/category/agents-immobiliers/city:yaounde,No,,,,,,,,,,"37674731; 62027671; +23722231622; +23765592158; 22167131; 32619201; +23762103908; +23767552804; +23769540556; 22221098; 22068466; 22226836; 22225073",google_serpapi,Nous avons trouvé 15 entreprises. · REPMA Cameroon · Unity Properties & Rentals · DABEXTRADINGCOMPANYSARL · Weetyu Logement · GROUPE NKAH · KemetHome · The Vortex ...,2026-03-16T12:36:55.536Z
Agencies - 237immobilier.com,https://237immobilier.com/agencies/,Yes,https://www.facebook.com/inspirythemes,Discussions,Yes,13000,61783158,,,https://themeforest.net/user/inspirythemes/portfolio?fbclid=IwZXh0bgNhZW0CMTAAYnJpZBExeGVPY21vZkFMR1cwSFhsV3NydGMGYXBwX2lkEDIyMjAzOTE3ODgyMDA4OTIAAR73YqDlDnvIEITeWc3bWpZVRkbxz8xv8ZQesNoG8x6bxChP54QneCEKa8sRZA_aem_SujTfNF61Er-AmQ-2eOPXQ,"hello@digi-tech.com; hello@yoursite.com; hello@digit-tech.com","37987884; 37791035; +23767193709; 37719370",google_serpapi,Alice is a broker associate and Realtor. She is dedicated in helping buyers and sellers throughout the city. She enjoys the local aspect of real estate.,2026-03-16T12:37:01.695Z
"Codecis - Agence immobilière cameroun, Yaounde, Douala",https://codecis.com/,Yes,https://www.facebook.com/codecis,Discussions,Yes,21000,61783166,info@codecis.com,Codecis: Immobilier Yaoundé,http://www.codecis.com/?fbclid=IwZXh0bgNhZW0CMTAAYnJpZBExeGVPY21vZkFMR1cwSFhsV3NydGMGYXBwX2lkEDIyMjAzOTE3ODgyMDA4OTIAAR58KLvtgRbYalMPvO_ucPfjbY_d_6zL-QULi11kShFfVEYYOfQib4De_z0CcA_aem_OVO3ZHVmBSlOcFofXATbiw,"medianetmandjan@gmail.com; info@codecis.com","+23767519520; 20250619; 20250804; 20260303; 23027110; 22996021; 23006863; 69838820; 20240521; 31536000; 20251215; 25686540",google_serpapi,"Nous vous accompagnons dans les opérations immobilières suivantes : · L'achat, la vente, la location ou la sous-location d'immeubles bâtis et non bâtis · L'achat, ...",2026-03-16T12:37:17.485Z
Mav SARL – Votre partenaire de confiance pour l'immobilier à ...,https://mav-sarl.com/,Yes,https://www.facebook.com/mavimmobilier237,Discussions,Yes,22000,61783173,,MAV Immobilier Cameroun,https://api.whatsapp.com/send?phone=+237694633002&token=eyJhbGciOiJFUzI1NiIsInR5cCI6IkpXVCIsImtpZCI6IjEyNSJ9.eyJleHAiOjE3NzM3NTEwNjcsInBob25lIjoiKzIzNzY5NDYzMzAwMiIsImNvbnRleHQiOiJBZmU0STk5ZVlYYWFwYS1leVhFNXNxd1JfMXB5bzVhUl95X2hzR1lDOXJwVWdQNkRkZGNCSHc0cTNGa3Mtc2NrcF9lRE5McUFDMDQwLWw5QWNBQTBfUzFxVVpacFZtTzVBVDVrdG9RcjNmbWZWcUF4VnQxTUtFRmIzbUM0akNrTjQycUtrOFR5Y1EzSGd5TEpJV2tqRzNFSl9RIiwic291cmNlIjoiRkJfUGFnZSIsImFwcCI6ImZhY2Vib29rIiwiZW50cnlfcG9pbnQiOiJwYWdlX2N0YSJ9.aUQXE8YXCvIn2_H2sGQY_UAdfcg2S4Hqw2nCcr9EG1ZEh1FR7_I2kS2I1qZL_ZLqSCDxl7eVK3wD3CmHhWGqtw&fbclid=IwZXh0bgNhZW0CMTAAYnJpZBExeGVPY21vZkFMR1cwSFhsV3NydGMGYXBwX2lkEDIyMjAzOTE3ODgyMDA4OTIAAR4e1xuzaObtngE6wuMnUP3llvbUJpxRzL2uUOym0m8X9CQbbDwmP6xDFmocGQ_aem_Vp95i3JJ5awPSARB0oaw7Q,"contact@mav-sarl.com; molloathanasevalery@gmail.com; johnny.ndzana@gmail.com","22343497; 32183491; 61372083; 32184061; 61123574; 28278708; 21900415; 32967801; 21900520; 30547964; 30547988; +23769463300; +23767487244; 20241017",google_serpapi,Yaoundé. Kribi · Douala · Sangmélima. Les avis de nos clients. J'ai eu une expérience incroyable avec MAV SARL lors de la recherche d'une villa à ...,2026-03-16T12:37:34.286Z
REAL Estate AGENT | Yaoundé,https://www.facebook.com/conseilimmobilier237/,No,,,,,,,,,,,google_serpapi,"REAL Estate AGENT, Yaoundé. 1158 likes · 2 talking about this. Conseil et Services Immobilier au Cameroun Location Achat Vente...",2026-03-16T12:37:52.451Z
Les entreprises de bâtiment et construction au Cameroun,https://www.goafricaonline.com/cm/annuaire/entreprises-batiment-construction,No,,,,,,,,,,65743929,duckduckgo,"Un des secteurs économiques les plus importants au Cameroun, la construction et la bâtiment regroupent énormément de professionnels et de secteurs d'activité. Retrouvez leurs coordonnées et informations de contact sur l'annuaire des entreprises du Cameroun.",2026-03-16T12:37:57.981Z
ZAC BTP | Construction & Génie Civil au Cameroun,https://groupezac.com/,No,,,,,,,,,,,duckduckgo,"ZAC BTP, membre du Groupe ZAC, votre partenaire de confiance pour la construction, les travaux publics et le génie civil au Cameroun. Plus de 25 ans d'expérience.",2026-03-16T12:38:03.319Z
Annuaire BTP Cameroun,https://www.produbtp.com/,No,,,,,,,,,support@webador.com,"29426751; 29426731; 29426689; 29426688; 29426707; 29387178; 29426715; 29426706; 24465890; 24478392; 24565432; 24478582; 24478614; 24478373; 24478629; 24478636; 24478638; 24478399; 24478651; 24478666; 24478682; 24478425; 24478701; 24478713; 24478435; 24478744; 24478755; 24479457; 24465936; 24478488",duckduckgo,"Annuaire BTP Cameroun est la référence pour trouver et promouvoir les professionnels du secteur de la construction au Cameroun. Des milliers d'entrepreneurs et entreprises sont à la recherche des professionnels qualifiés, disponibles pour mener à bien leurs projets de construction.",2026-03-16T12:38:08.736Z
Entreprise de construction au Cameroun - GCOREBTP,https://gcorebtp.com/,Yes,https://www.facebook.com/gcorebtp,Discussions,Yes,1000,61783190,,,https://api.whatsapp.com/send?phone=+237655413116&token=eyJhbGciOiJFUzI1NiIsInR5cCI6IkpXVCIsImtpZCI6IjEyNSJ9.eyJleHAiOjE3NzM3NTExMDYsInBob25lIjoiKzIzNzY1NTQxMzExNiIsImNvbnRleHQiOiJBZmU3SFNKZjBTbHVpQlZWYkFndUxFbVZidWl1VlY4WGhfX3JHcmNlbWk1aFFmeG1ycFJWM3BLQmZqV2FvX1NIa0R5dnNxWjhNSlNpQTFoRlhFZ244anNnM3YyVFhYcHI2MURmNU9DRVAwMWNod2FXQlpyUUd0SmxIYjJmYzN5ZDdnQ243ajdvMTJCelN0a0RjMFE5V0V2ajBBIiwic291cmNlIjoiRkJfUGFnZSIsImFwcCI6ImZhY2Vib29rIiwiZW50cnlfcG9pbnQiOiJwYWdlX2N0YSJ9.-_pZ0Vb8UuEQOmoj-CQf9PNGjRm5IEuUIKs2XXvnj8UvRpRxUw3WnDazqohzKpNsVYGPDudFQpkQkFFaM09oWg&fbclid=IwZXh0bgNhZW0CMTAAYnJpZBExeGVPY21vZkFMR1cwSFhsV3NydGMGYXBwX2lkEDIyMjAzOTE3ODgyMDA4OTIAAR4QK9SGbN6BhytaJFNIpOw8bg-HI_MWN1VcMAxSp7lHIuM_hPF-ez-c5h5imA_aem_BAuyiA0LvgtARvtVq4CAHw,contact@gcorebtp.com,"68612248; 20230728; 20250219; 69867573; 27543848; 64431187; 20192020; 20202021; +23765541311; 23765541; 20260202; 25686540",duckduckgo,"Gcore BTP, entreprise de construction au Cameroun, se distingue par son expertise et son engagement à livrer des maisons modernes, élégantes et durables. Nous vous accompagnons du premier croquis jusqu'à la remise des clés.",2026-03-16T12:38:15.535Z
Buildings and Business SARL - Entreprise de Construction au Cameroun ...,https://buildingsbusiness.com/,Yes,https://www.facebook.com/buildingsbusiness,Discussions,No,,61783197,,,,,,duckduckgo,"Buildings and Business SARL, entreprise de construction et génie civil au Cameroun. Construction résidentielle, commerciale, travaux publics. Ici on Commence, Ici On Termine! Plus de 2 ans d'expérience à Yaoundé.",2026-03-16T12:38:31.386Z
btp-Accueil - Groupe Nchouwat & Fils,https://grpnchouwatbtp.cm/,No,,,,,,,,,anchouwat238@gmail.com,"+23769697685; 20250211; 20250420; 33333333",duckduckgo,"Entreprise spécialisée en BTP, bâtiment, génie civil, et travaux publics au Cameroun. Nos projets allient qualité, rapidité et professionnalisme.",2026-03-16T12:38:45.819Z
